{
  "$schema": "https://json-schema.org/draft/2020-12/schema",
  "$id": "https://github.com/mbta/schemas/blob/main/schemas/glides-events.json",
  "title": "Glides Events",
  "description": "Kinesis events emitted by Glides",
  "$ref": "cloudevents.json",
  "type": "object",
  "properties": {
    "type": {
      "type": "string",
      "description": "name of the event",
      "$comment": "enforced to be a valid event name by the oneOf, below"
    },
    "specversion": { "const": "1.0" },
    "source": {
      "$ref": "cloudevents.json#/properties/source",
      "examples": [
        "glides.mbta.com",
        "glides-dev.mbtace.com",
        "glides-dev-green.mbtace.com"
      ]
    },
    "id": { "type": "string", "minLength": 1 },
    "time": { "$ref": "#/$defs/timestamp" },
    "data": {
      "type": "object",
      "properties": {
        "metadata": { "$ref": "#/$defs/metadata" }
      },
      "required": ["metadata"],
      "$comment": "other fields validated by the oneOf, below"
    }
  },
  "required": ["type", "specversion", "source", "id", "time", "data"],
  "oneOf": [
    {
      "properties": {
        "type": { "const": "com.mbta.ctd.glides.editors_changed.v1" }
      },
      "$ref": "com.mbta.ctd.glides.editors_changed.v1.json#/"
    },
    {
      "properties": {
        "type": { "const": "com.mbta.ctd.glides.operator_signed_in.v1" }
      },
      "$ref": "com.mbta.ctd.glides.operator_signed_in.v1.json#/"
    },
    {
      "properties": {
        "type": { "const": "com.mbta.ctd.glides.trips_updated.v1" }
      },
      "$ref": "com.mbta.ctd.glides.trips_updated.v1.json#/"
    }
  ],
  "$defs": {
    "badge_number": {
      "type": "string",
      "minLength": 1,
      "pattern": "^[1-9][0-9]*$",
      "$comment": "without any leading 0s"
    },
    "email_address": {
      "$comment": "format validation isn't supported everywhere, so also do some simple string checks",
      "type": "string",
      "minLength": 3,
      "format": "email",
      "pattern": "@"
    },
    "glides_user": {
      "type": "object",
      "properties": {
        "emailAddress": { "$ref": "#/$defs/email_address" },
        "badgeNumber": { "$ref": "#/$defs/badge_number" }
      },
      "required": ["emailAddress"]
    },
    "location": {
      "type": "object",
      "oneOf": [
        {
          "properties": {
            "gtfsId": { "type": "string", "minLength": 1 }
          },
          "required": ["gtfsId"]
        },
        {
          "properties": {
            "odsId": { "type": "string", "minLength": 1 }
          },
          "required": ["odsId"]
        }
      ]
    },
    "metadata": {
      "type": "object",
      "properties": {
        "author": { "$ref": "#/$defs/glides_user" },
        "inputTimestamp": { "$ref": "#/$defs/timestamp" },
        "inputType": { "type": "string", "minLength": 1 },
        "location": { "$ref": "#/$defs/location" }
      }
    },
    "operator": {
      "type": "object",
      "properties": {
        "badgeNumber": { "$ref": "#/$defs/badge_number" }
      },
      "required": ["badgeNumber"]
    },
    "timestamp": {
      "type": "string",
      "minLength": 20,
      "$comment": "RFC3339 timestamp",
      "format": "date-time",
      "pattern": "^[0-9]{4}-[01][0-9]-[0-3][0-9]T[012][0-9]:[0-5][0-9]:[0-6][0-9](.[0-9]*)?(Z|[+-][012][0-9]:[0-5][0-9])$",
      "examples": ["2023-01-20T09:30:00-05:00"]
    }
  }
}
