[
  {
    "type": "com.mbta.ctd.glides.trips_updated.v1",
    "specversion": "1.0",
    "source": "glides.mbta.com",
    "id": "19fdb184-7dd6-4664-8472-04bd6177ec44",
    "time": "2023-01-20T09:30:00-05:00",
    "data": {
      "metadata": {
        "inputType": "dropped-trip"
      },
      "tripUpdates": [
        {
          "type": "updated",
          "tripKey": {
            "serviceDate": "2022-01-20",
            "startLocation": { "gtfsId": "place-lake" },
            "endLocation": { "gtfsId": "place-gover" },
            "startTime": "10:05:00",
            "endTime": "10:52:00"
          },
          "dropped": { "reason": "staffing" },
          "scheduled": { "scheduledCars": [{}] }
        },
        {
          "type": "updated",
          "tripKey": {
            "serviceDate": "2022-01-20",
            "startLocation": { "gtfsId": "place-gover" },
            "endLocation": { "gtfsId": "place-lake" },
            "startTime": "10:55:00",
            "endTime": "10:42:00"
          },
          "dropped": { "reason": "staffing" },
          "scheduled": { "scheduledCars": [{}] }
        }
      ]
    }
  },
  {
    "type": "com.mbta.ctd.glides.trips_updated.v1",
    "specversion": "1.0",
    "source": "glides.mbta.com",
    "id": "19fdb184-7dd6-4664-8472-04bd6177ec44",
    "time": "2023-01-20T09:30:00-05:00",
    "data": {
      "metadata": {
        "inputType": "manage-headways"
      },
      "tripUpdates": [
        {
          "type": "updated",
          "tripKey": {
            "serviceDate": "2022-01-20",
            "startLocation": { "gtfsId": "place-lake" },
            "endLocation": { "gtfsId": "place-gover" },
            "startTime": "09:55:00",
            "endTime": "10:42:00"
          },
          "startTime": "09:56:00",
          "scheduled": { "scheduledCars": [{}] }
        },
        {
          "type": "updated",
          "tripKey": {
            "serviceDate": "2022-01-20",
            "startLocation": { "gtfsId": "place-lake" },
            "endLocation": { "gtfsId": "place-gover" },
            "startTime": "10:00:00",
            "endTime": "10:47:00"
          },
          "startTime": "10:02:00",
          "scheduled": { "scheduledCars": [{}] }
        },
        {
          "type": "updated",
          "tripKey": {
            "serviceDate": "2022-01-20",
            "startLocation": { "gtfsId": "place-lake" },
            "endLocation": { "gtfsId": "place-gover" },
            "startTime": "10:10:00",
            "endTime": "10:57:00"
          },
          "startTime": "10:08:00",
          "scheduled": { "scheduledCars": [{}] }
        }
      ]
    }
  }
]
