{
  "type": "com.mbta.ctd.glides.trips_updated.v1",
  "specversion": "1.0",
  "source": "glides.mbta.com",
  "id": "19fdb184-7dd6-4664-8472-04bd6177ec44",
  "time": "2023-01-23T01:25:00-05:00",
  "data": {
    "metadata": {
      "inputType": "edit-trip"
    },
    "tripUpdates": [
      {
        "type": "updated",
        "tripKey": {
          "serviceDate": "2023-01-22",
          "startLocation": { "gtfsId": "place-matt" },
          "endLocation": { "gtfsId": "place-ashmt" },
          "startTime": "25:30:00",
          "endTime": "25:38:00"
        },
        "startTime": "25:45:00",
        "scheduled": {
          "scheduledCars": [
            {
              "run": "500",
              "operator": { "badgeNumber": "1234" }
            }
          ]
        }
      }
    ]
  }
}
